{
  "session_id": "6bae5b13-c3dc-4541-9504-b6268030a1e9",
  "level": "l5",
  "repo_root": "/home/cookys/projects/gate-sandbox2",
  "started_at": "2026-10-05T13:47:54.709Z",
  "expires_at": "2026-10-06T13:47:54.709Z",
  "repo_identity": "git-common-dir:/home/cookys/projects/gate-sandbox2/.git",
  "project_key": "bd9bd5b9221b0b2a",
  "root_run_id": "job-1791208074-91773e8e",
  "entry_level": "l5",
  "fallback_reason": "none",
  "mission_routing": {
    "status": "READY",
    "admitted": true,
    "would_block": false,
    "prior_marker_status": "absent",
    "admission": {
      "schema_version": 1,
      "artifact_type": "mission_routing_admission",
      "authority_status": "enforce",
      "repo_identity": "git-common-dir:/home/cookys/projects/gate-sandbox2/.git",
      "mission_policy_digest": "23373ee72afbff25f8be9b16f3bcd18e3e07a4b88e9f7071d282e54b8e84bdb9",
      "mission_graph_digest": "beb0e5cd14f5a2531254c4b589c0d77b616b982244ce2a522441dc1bd4193053",
      "sources_digest": "c90fd08261712ab651d590069bff48c8ad0b06521923ba776e99a901f054f227",
      "deliverable_count": 1,
      "source_authoring_unit_count": 0,
      "critical_path": 1,
      "batch_count": 1,
      "reservation_totals": {
        "campaigns": 1,
        "wall_seconds": 3600,
        "tool_calls": 100,
        "engine_attempts": 2,
        "external_wait_seconds": 900,
        "canonical_changed_files": 1,
        "output_bytes": 100000
      },
      "admission_digest": "13d479acf1b20225e2b68d6c7de3c2a173c945b40605bdcbecd0564b37cf2693"
    }
  },
  "mission_noop": {
    "schema_version": 1,
    "artifact_type": "mission_noop_adoption_set",
    "admission_digest": "13d479acf1b20225e2b68d6c7de3c2a173c945b40605bdcbecd0564b37cf2693",
    "noop_adoptions": [],
    "noop_short_circuit": false,
    "dispatcher_called": null,
    "mutation_attempts": null,
    "gate_attempts": null,
    "resources_created": null,
    "digest": "e1c4317d6f38f32f40c71ada110ea115d9da6d1f01da4f38b7f035c77f7cd1b3"
  }
}
