{
  "session_id": "c4841c60-1b5d-4cc6-97da-b59f4c2dc080",
  "level": null,
  "repo_root": "/home/cookys/projects/gate-sandbox",
  "started_at": "2026-10-05T09:00:28.699Z",
  "expires_at": "2026-10-06T09:00:28.699Z",
  "repo_identity": "git-common-dir:/home/cookys/projects/gate-sandbox/.git",
  "project_key": "51de403da82a23f0",
  "root_run_id": "job-1791190828-903b5a78"
}
